{
  "$schema": "http://json-schema.org/draft-07/schema#",
  "$id": "https://github.com/jjayeshneo/Cortex-Benchmark/schema/leaderboard_entry.schema.json",
  "title": "Cortex-Bench leaderboard entry",
  "description": "One committed JSON file per leaderboard row. The results/ directory is the source of truth; the published site is a build artifact regenerated from these files. CI validates every entry against this schema on pull request.",
  "type": "object",
  "additionalProperties": false,
  "required": [
    "entry_id",
    "system",
    "model",
    "protocol",
    "results",
    "declarations"
  ],
  "properties": {
    "entry_id": {
      "type": "string",
      "pattern": "^[0-9]{4}-[0-9]{2}-[0-9]{2}-[a-z0-9][a-z0-9-]*$",
      "description": "YYYY-MM-DD-slug. Must equal the filename stem."
    },
    "system": {
      "type": "object",
      "additionalProperties": false,
      "required": [
        "name",
        "organization",
        "open_source",
        "arm"
      ],
      "properties": {
        "name": {
          "type": "string",
          "minLength": 1
        },
        "version": {
          "type": [
            "string",
            "null"
          ]
        },
        "organization": {
          "type": "string",
          "minLength": 1
        },
        "url": {
          "type": [
            "string",
            "null"
          ],
          "format": "uri"
        },
        "paper": {
          "type": [
            "string",
            "null"
          ]
        },
        "code": {
          "type": [
            "string",
            "null"
          ]
        },
        "open_source": {
          "type": "boolean"
        },
        "kind": {
          "type": "string",
          "enum": [
            "agent",
            "single-call",
            "framework",
            "human",
            "reference"
          ],
          "description": "reference = a mechanical floor or ceiling row, not a competing system."
        },
        "arm": {
          "type": "string",
          "enum": [
            "controlled",
            "commercial"
          ],
          "description": "Which band the row is ranked in. 'controlled' = a scaffold over the arm's one fixed base model, so the ordering is a scaffold comparison. 'commercial' = a shipped product bringing its own model. Never inferred from the model name: a row's band is a statement about how it was evaluated, not about what it runs. Distinct from model.controlled, which is about weight custody, not banding."
        }
      }
    },
    "model": {
      "type": "object",
      "additionalProperties": false,
      "required": [
        "name",
        "access"
      ],
      "properties": {
        "name": {
          "type": [
            "string",
            "null"
          ],
          "description": "null only for human or mechanical entries."
        },
        "provider": {
          "type": [
            "string",
            "null"
          ]
        },
        "access": {
          "type": "string",
          "enum": [
            "api",
            "open-weights",
            "local",
            "none"
          ]
        },
        "training_cutoff": {
          "type": [
            "string",
            "null"
          ]
        },
        "temperature": {
          "type": [
            "number",
            "null"
          ]
        },
        "controlled": {
          "type": [
            "boolean",
            "null"
          ],
          "description": "true if the submitter controls the weights; false for a hosted endpoint that may change under them. This is about weight custody and is NOT the leaderboard band -- every entry so far runs against a hosted endpoint and is correctly false here, including the controlled-arm rows. For the band, see system.arm."
        },
        "config_note": {
          "type": [
            "string",
            "null"
          ],
          "description": "Short, reader-facing note when this row's model was configured differently from other rows on the same model -- reasoning effort, context window, endpoint. Rendered on the board next to the model name, because two rows sharing a model name but not a configuration are not a scaffold-only comparison and a reader cannot tell from the numbers alone."
        }
      }
    },
    "protocol": {
      "type": "object",
      "additionalProperties": false,
      "required": [
        "split",
        "corpus_version",
        "data_snapshot_id",
        "scorer_version",
        "runs",
        "denominator",
        "evaluated_at"
      ],
      "properties": {
        "split": {
          "type": "string",
          "enum": [
            "sample",
            "dev",
            "test",
            "full"
          ]
        },
        "corpus_version": {
          "type": "string"
        },
        "data_snapshot_id": {
          "type": "string",
          "description": "Gold answers are snapshot-bound. Entries scored against different snapshots are NOT comparable and the site groups them separately."
        },
        "scorer_version": {
          "type": "string"
        },
        "runs": {
          "type": "integer",
          "minimum": 1
        },
        "denominator": {
          "type": "integer",
          "description": "Total gradable tasks. Every entry on one board must share this number. Tasks the system did not attempt count as failures."
        },
        "attempted": {
          "type": [
            "integer",
            "null"
          ],
          "description": "Tasks the system actually produced an answer for. attempted < denominator is displayed, never hidden."
        },
        "evidence_provided": {
          "type": [
            "boolean",
            "null"
          ]
        },
        "verified_by_organizers": {
          "type": "boolean",
          "default": false
        },
        "evaluated_at": {
          "type": "string",
          "format": "date-time"
        }
      }
    },
    "results": {
      "type": "object",
      "required": [
        "execution_accuracy"
      ],
      "additionalProperties": {
        "$ref": "#/definitions/metric"
      },
      "properties": {
        "execution_accuracy": {
          "$ref": "#/definitions/metric"
        },
        "session_accuracy": {
          "$ref": "#/definitions/metric"
        },
        "multi_turn_session_accuracy": {
          "$ref": "#/definitions/metric"
        },
        "multi_turn_turn_accuracy": {
          "$ref": "#/definitions/metric"
        },
        "cost_usd_per_task": {
          "$ref": "#/definitions/metric"
        },
        "median_latency_s": {
          "$ref": "#/definitions/metric"
        },
        "pass_any": {
          "$ref": "#/definitions/metric"
        },
        "pass_all": {
          "$ref": "#/definitions/metric"
        },
        "by_tier": {
          "type": "object",
          "description": "tier number -> pass^N for that tier: the fraction of the tier's tasks the system solved on EVERY run. Matches the headline metric, so a tier row and the board row mean the same thing.",
          "additionalProperties": {
            "type": "number",
            "minimum": 0,
            "maximum": 1
          }
        },
        "by_session": {
          "type": "object",
          "description": "session_id -> how that multi-turn session went under the CHAINED protocol. turns_passed counts turns solved on EVERY run, matching the headline metric. session_passed is true only when every turn in the session passed on every run, which is what session success rate counts. Recorded per session because a 6-of-8 near miss and a 0-of-8 collapse are both 'fail' otherwise.",
          "additionalProperties": {
            "type": "object",
            "additionalProperties": false,
            "required": [
              "turns_passed",
              "turns_total",
              "session_passed"
            ],
            "properties": {
              "turns_passed": {
                "type": "integer",
                "minimum": 0
              },
              "turns_total": {
                "type": "integer",
                "minimum": 1
              },
              "session_passed": {
                "type": "boolean"
              }
            }
          }
        }
      }
    },
    "declarations": {
      "type": "object",
      "additionalProperties": false,
      "required": [
        "test_data_seen",
        "human_in_loop"
      ],
      "properties": {
        "canary_check": {
          "type": [
            "string",
            "null"
          ],
          "enum": [
            "passed",
            "failed",
            "not-applicable",
            null
          ]
        },
        "test_data_seen": {
          "type": "boolean"
        },
        "human_in_loop": {
          "type": "boolean"
        },
        "artifacts": {
          "type": [
            "string",
            "null"
          ],
          "description": "Where the raw per-task outputs live, if published."
        },
        "notes": {
          "type": [
            "string",
            "null"
          ]
        }
      }
    }
  },
  "definitions": {
    "metric": {
      "type": "object",
      "additionalProperties": false,
      "required": [
        "mean"
      ],
      "properties": {
        "mean": {
          "type": [
            "number",
            "null"
          ]
        },
        "std": {
          "type": [
            "number",
            "null"
          ]
        },
        "runs": {
          "type": "array",
          "items": {
            "type": [
              "number",
              "null"
            ]
          },
          "description": "Every run's value, including the bad ones. Cherry-picking a run is the single easiest way to fake a leaderboard number, so all runs are published."
        },
        "n": {
          "type": [
            "integer",
            "null"
          ],
          "description": "Numerator, where the metric is a count over `denominator`."
        },
        "unavailable_reason": {
          "type": [
            "string",
            "null"
          ],
          "description": "Set with mean:null when a metric could not be measured. A null with a reason is honest; a zero is a lie."
        }
      }
    }
  }
}
