{
  "entry_id": "2026-09-02-crewai-crew",
  "system": {
    "name": "CrewAI",
    "version": "crewai 1.15.2, sequential crew (SQL Analyst + Query Validator)",
    "organization": "Cortex-Bench organizers (reference implementation)",
    "url": null,
    "paper": null,
    "code": null,
    "open_source": true,
    "kind": "framework",
    "arm": "controlled"
  },
  "model": {
    "name": "gpt-5.6-luna",
    "provider": "OpenAI",
    "access": "api",
    "training_cutoff": null,
    "temperature": null,
    "controlled": false
  },
  "protocol": {
    "split": "full",
    "corpus_version": "v1.3",
    "data_snapshot_id": "wm_synthetic_v1.3_2026_09_01",
    "scorer_version": "cortex_scorer_v1.6",
    "runs": 3,
    "denominator": 190,
    "attempted": 190,
    "evidence_provided": true,
    "verified_by_organizers": true,
    "evaluated_at": "2026-09-17T00:28:24Z"
  },
  "results": {
    "execution_accuracy": {
      "mean": 0.633333,
      "n": 120,
      "std": 0.021271,
      "runs": [
        0.652632,
        0.636842,
        0.610526
      ]
    },
    "session_accuracy": {
      "mean": 0.645435,
      "std": 0.013259,
      "runs": [
        0.649682,
        0.656051,
        0.630573
      ]
    },
    "multi_turn_session_accuracy": {
      "mean": 0.041667,
      "std": 0.072169,
      "runs": [
        0.125,
        0.0,
        0.0
      ],
      "n": 0
    },
    "multi_turn_turn_accuracy": {
      "mean": 0.471545,
      "std": 0.078404,
      "runs": [
        0.560976,
        0.439024,
        0.414634
      ],
      "n": 15
    },
    "pass_any": {
      "mean": 0.710526,
      "n": 135
    },
    "pass_all": {
      "mean": 0.557895,
      "n": 106
    },
    "cost_usd_per_task": {
      "mean": 0.004239,
      "std": 0.000123,
      "runs": [
        0.004132,
        0.004221,
        0.004368
      ]
    },
    "tokens_per_task": {
      "mean": 15172.7,
      "std": 411.0,
      "runs": [
        14884.0,
        14992.1,
        15642.0
      ]
    },
    "median_latency_s": {
      "mean": 8.0
    },
    "by_tier": {
      "1": 0.7143,
      "2": 0.8667,
      "3": 0.6286,
      "4": 0.6286,
      "5": 0.6667,
      "6": 0.2,
      "7": 0.9,
      "8": 0.3659
    },
    "by_session": {
      "S1": {
        "turns_passed": 5,
        "turns_total": 9,
        "session_passed": false
      },
      "S2": {
        "turns_passed": 5,
        "turns_total": 8,
        "session_passed": false
      },
      "S3": {
        "turns_passed": 2,
        "turns_total": 4,
        "session_passed": false
      },
      "S4": {
        "turns_passed": 0,
        "turns_total": 4,
        "session_passed": false
      },
      "S5": {
        "turns_passed": 2,
        "turns_total": 4,
        "session_passed": false
      },
      "S6": {
        "turns_passed": 1,
        "turns_total": 4,
        "session_passed": false
      },
      "S7": {
        "turns_passed": 0,
        "turns_total": 4,
        "session_passed": false
      },
      "S8": {
        "turns_passed": 0,
        "turns_total": 4,
        "session_passed": false
      }
    }
  },
  "declarations": {
    "canary_check": "not-applicable",
    "test_data_seen": false,
    "human_in_loop": false,
    "artifacts": "runs/crewai_run{1,2,3}.jsonl and runs/crewai_run{1,2,3}_score/ (organizer-side; per-task SQL, verdict, latency, token counts and cost for all three runs)",
    "notes": "Single-turn only: the 41 tier-8 multi-turn turns were not attempted and are scored as failures, which is why execution accuracy over the 190-task denominator sits far below the single-turn subset figure of 67.1%. All three runs answered 149/149 with no refusal and no SQL error. MODEL CONFIGURATION DIFFERS FROM THE LANGCHAIN ROW: gpt-5.6-luna is a reasoning model, and OpenAI rejects function tools alongside reasoning on /v1/chat/completions. The LangChain arm keeps reasoning by using the Responses API; CrewAI 1.15.2's Responses support is single-turn only and cannot carry a tool loop, so this arm runs with reasoning_effort='none' via CrewAI's supported additional_params passthrough. Both arms are otherwise identical -- same 149 task ids, same grounding string, same schema, same read-only snapshot, same runner, same scorer -- but the reasoning difference means this row is not a clean scaffold-only comparison with the LangChain row. Token counts are exact crew usage metrics, not estimates. CHAINED MULTI-TURN, 2026-09-17: this row now covers all 190 tasks. The 41 tier-8 turns are no longer skipped and are no longer fed an authored gold prior -- each turn receives the agent's OWN SQL from the immediately preceding turn of that session, right or wrong and unrepaired. Pass^N and Pass@N are therefore over 190, not 149: every system now attempts every task, so the old 'only count what it took on' denominator no longer applies. Comparing this row's percentage with a pre-2026-09-17 one compares two denominators. See ERRATA E-2026-09-17-13."
  }
}
