{
  "entry_id": "2026-09-03-nao",
  "system": {
    "name": "nao",
    "version": "nao agent with dataset context layer, /api/agent SSE",
    "organization": "Cortex-Bench organizers (reference implementation)",
    "url": null,
    "paper": null,
    "code": null,
    "open_source": false,
    "kind": "agent",
    "arm": "controlled"
  },
  "model": {
    "name": "gpt-5.6-luna",
    "provider": "OpenAI",
    "access": "api",
    "training_cutoff": null,
    "temperature": null,
    "controlled": false
  },
  "protocol": {
    "split": "full",
    "corpus_version": "v1.3",
    "data_snapshot_id": "wm_synthetic_v1.3_2026_09_01",
    "scorer_version": "cortex_scorer_v1.6",
    "runs": 3,
    "denominator": 190,
    "attempted": 190,
    "evidence_provided": true,
    "verified_by_organizers": true,
    "evaluated_at": "2026-09-17T00:28:24Z"
  },
  "results": {
    "execution_accuracy": {
      "mean": 0.557895,
      "n": 106,
      "std": 0.032014,
      "runs": [
        0.573684,
        0.578947,
        0.521053
      ]
    },
    "session_accuracy": {
      "mean": 0.615711,
      "std": 0.01471,
      "runs": [
        0.624204,
        0.624204,
        0.598726
      ]
    },
    "multi_turn_session_accuracy": {
      "mean": 0.0,
      "std": 0.0,
      "runs": [
        0.0,
        0.0,
        0.0
      ],
      "n": 0
    },
    "multi_turn_turn_accuracy": {
      "mean": 0.227642,
      "std": 0.09234,
      "runs": [
        0.268293,
        0.292683,
        0.121951
      ],
      "n": 5
    },
    "pass_any": {
      "mean": 0.631579,
      "n": 120
    },
    "pass_all": {
      "mean": 0.463158,
      "n": 88
    },
    "cost_usd_per_task": {
      "mean": 0.008123,
      "std": 0.000288,
      "runs": [
        0.008446,
        0.008031,
        0.007893
      ]
    },
    "median_latency_s": {
      "mean": 12.4
    },
    "by_tier": {
      "1": 0.7857,
      "2": 0.8,
      "3": 0.6,
      "4": 0.6,
      "5": 0.4,
      "6": 0.08,
      "7": 1.0,
      "9": 0.122
    },
    "by_session": {
      "S1": {
        "turns_passed": 3,
        "turns_total": 9,
        "session_passed": false
      },
      "S2": {
        "turns_passed": 0,
        "turns_total": 8,
        "session_passed": false
      },
      "S3": {
        "turns_passed": 1,
        "turns_total": 4,
        "session_passed": false
      },
      "S4": {
        "turns_passed": 0,
        "turns_total": 4,
        "session_passed": false
      },
      "S5": {
        "turns_passed": 0,
        "turns_total": 4,
        "session_passed": false
      },
      "S6": {
        "turns_passed": 1,
        "turns_total": 4,
        "session_passed": false
      },
      "S7": {
        "turns_passed": 0,
        "turns_total": 4,
        "session_passed": false
      },
      "S8": {
        "turns_passed": 0,
        "turns_total": 4,
        "session_passed": false
      }
    }
  },
  "declarations": {
    "canary_check": "not-applicable",
    "test_data_seen": false,
    "human_in_loop": false,
    "artifacts": "runs/nao_run1_fix.jsonl, runs/nao_run2.jsonl, runs/nao_run3.jsonl and runs/nao_run{1,2,3}_score_v1_1/ plus runs/nao_3run_score/ (organizer-side; per-task SQL, verdict, latency and cost for all three runs)",
    "notes": "Single-turn only: the 41 tier-9 multi-turn turns were not attempted and are scored as failures, which is why execution accuracy over the 190-task denominator sits below the single-turn subset figure. Runs 2 and 3 answered 148/149 and 147/149; run 1 declined 29 tasks, but only 3 tasks are solved by runs 2 and 3 and not by run 1, and none of those 3 were declines, so run 1 is not a degraded run. Token counts are unavailable: nao's SSE endpoint does not surface per-call usage, so tokens_per_task is null rather than estimated. Cost is the sum of nao's own reported per-task cost. Run 1's answers were re-executed against the release snapshot after an earlier run had hit a DuckDB catalog-name mismatch; the agent's generated SQL is unmodified and re-execution is the same path the harness uses for every arm. nao reads a dataset context layer carrying table and column documentation, which the LangChain and CrewAI arms do not, so this row is not a scaffold-only comparison with them. CHAINED MULTI-TURN, 2026-09-17: this row now covers all 190 tasks. The 41 tier-9 turns are no longer skipped and are no longer fed an authored gold prior -- each turn receives the agent's OWN SQL from the immediately preceding turn of that session, right or wrong and unrepaired. Pass^N and Pass@N are therefore over 190, not 149: every system now attempts every task, so the old 'only count what it took on' denominator no longer applies. Comparing this row's percentage with a pre-2026-09-17 one compares two denominators. See ERRATA E-2026-09-17-13."
  }
}
